{
  "closure": {
    "administrative_records": "DIRECTLY_REGISTERED_AND_VALIDATED",
    "enumeration_exclusions": 0,
    "final_lock": "SOLE_FINAL_GIT_TREE_TERMINAL"
  },
  "coverage": "EXPLICIT_ONE_RECORD_ONE_TREATMENT_NO_PREFIX_OR_CATCH_ALL",
  "record_count": 86,
  "record_id": "VAL001-GOVERNED-SCHEMA-REGISTRY-3",
  "records": [
    {
      "artifact_record_id": "VAL001-ADMINISTRATIVE-CLOSURE-SPECIFICATION-1",
      "audit_only": false,
      "binder": "validation/val001/contracts/VAL_001_ADMINISTRATIVE_CLOSURE_FREEZE.json",
      "binding_class": "BOUND_BY_ADMINISTRATIVE_FREEZE",
      "claim_ceiling": "NO_PHYSICAL_VALIDATION_OR_NEW_PHYSICS",
      "current": true,
      "executable": false,
      "path": "validation/val001/VAL_001_ADMINISTRATIVE_CLOSURE_SPECIFICATION.json",
      "puckworks_lock_applicable": true,
      "record_class": "GOVERNANCE_RECORD",
      "record_id": "INV-0B75F8E3AA7B4107CFB2",
      "schema_id": "espresso.val001.administrative_closure_specification.v1",
      "schema_origin": "EXPLICIT_CLASS_OR_VERSION_SEMANTICS",
      "schema_path": "validation/val001/schemas/administrative_closure_specification.schema.json",
      "schema_version": "espresso.val001.administrative_closure_specification.v1",
      "semantic_profile": "VAL001_EXPLICIT_PROFILE_V1",
      "semantic_validator": "VALIDATE_DEEP_AND_CROSS_RECORD",
      "sha256": null,
      "static_validation": "REQUIRED",
      "structure_signature_sha256": "7789341f82b4daba3268df34dfd1cf867cc680d631f74a42122769e17ca9777d",
      "treatment": "CURRENT_DEEP_SCHEMA"
    },
    {
      "artifact_record_id": "VAL001-CALIBRATION-COMPARISON-LEDGER-2",
      "audit_only": false,
      "binder": "validation/val001/contracts/VAL_001_ADMINISTRATIVE_CLOSURE_FREEZE.json",
      "binding_class": "ORDINARY_HASH_BOUND_RECORD",
      "claim_ceiling": "NO_PHYSICAL_VALIDATION_OR_NEW_PHYSICS",
      "current": true,
      "executable": false,
      "path": "validation/val001/VAL_001_CALIBRATION_COMPARISON_LEDGER.json",
      "puckworks_lock_applicable": true,
      "record_class": "LEDGER",
      "record_id": "INV-515D0D17DAEFDD8A5D35",
      "schema_id": "ledger.v32",
      "schema_origin": "EXPLICIT_CLASS_OR_VERSION_SEMANTICS",
      "schema_path": "validation/val001/schemas/deep_record_families.schema.json",
      "schema_version": "espresso.val001.calibration_comparison_ledger.v2",
      "semantic_profile": "VAL001_EXPLICIT_PROFILE_V1",
      "semantic_validator": "VALIDATE_DEEP_AND_CROSS_RECORD",
      "sha256": "a9b4fb8befc7e591096e09dc895c4098c025ea13c4c44adb302baca64fd8de6e",
      "static_validation": "REQUIRED",
      "structure_signature_sha256": "b75814771753e2edaa0afdc6f4f178968438ee79709f6d591a5c5e5377697034",
      "treatment": "CURRENT_DEEP_SCHEMA"
    },
    {
      "artifact_record_id": "VAL001-EXP001-EXP009-PROVENANCE",
      "audit_only": false,
      "binder": "validation/val001/contracts/VAL_001_ADMINISTRATIVE_CLOSURE_FREEZE.json",
      "binding_class": "ORDINARY_HASH_BOUND_RECORD",
      "claim_ceiling": "NO_PHYSICAL_VALIDATION_OR_NEW_PHYSICS",
      "current": true,
      "executable": false,
      "path": "validation/val001/VAL_001_CAMPAIGN_PROVENANCE.json",
      "puckworks_lock_applicable": true,
      "record_class": "CAMPAIGN_PROVENANCE",
      "record_id": "INV-2EF2905B90FB05CF267D",
      "schema_id": "campaign_provenance.v7",
      "schema_origin": "EXPLICIT_CLASS_OR_VERSION_SEMANTICS",
      "schema_path": "validation/val001/schemas/deep_record_families.schema.json",
      "schema_version": "espresso.val001.campaign_provenance.v1",
      "semantic_profile": "VAL001_EXPLICIT_PROFILE_V1",
      "semantic_validator": "VALIDATE_DEEP_AND_CROSS_RECORD",
      "sha256": "b0b6bc8b9727bf1ebfe085516358e5a475305dcb6ee7116c79367a52998864fe",
      "static_validation": "REQUIRED",
      "structure_signature_sha256": "c30c5c38344e0d9e4add0c2ba23d40be86a4dec3cccbb4ecaca8f79b3c48c931",
      "treatment": "CURRENT_DEEP_SCHEMA"
    },
    {
      "artifact_record_id": "VAL001-DEEP-SCHEMA-COVERAGE-MATRIX-1",
      "audit_only": false,
      "binder": "validation/val001/contracts/VAL_001_ADMINISTRATIVE_CLOSURE_FREEZE.json",
      "binding_class": "BOUND_BY_ADMINISTRATIVE_FREEZE",
      "claim_ceiling": "NO_PHYSICAL_VALIDATION_OR_NEW_PHYSICS",
      "current": true,
      "executable": false,
      "path": "validation/val001/VAL_001_DEEP_SCHEMA_COVERAGE_MATRIX.json",
      "puckworks_lock_applicable": true,
      "record_class": "GOVERNANCE_RECORD",
      "record_id": "INV-4E4A94E3F13BB4D21935",
      "schema_id": "espresso.val001.deep_schema_coverage_matrix.v1",
      "schema_origin": "EXPLICIT_CLASS_OR_VERSION_SEMANTICS",
      "schema_path": "validation/val001/schemas/coverage_matrix.schema.json",
      "schema_version": "espresso.val001.deep_schema_coverage_matrix.v1",
      "semantic_profile": "VAL001_EXPLICIT_PROFILE_V1",
      "semantic_validator": "VALIDATE_DEEP_AND_CROSS_RECORD",
      "sha256": null,
      "static_validation": "REQUIRED",
      "structure_signature_sha256": "93c5c8b0b26f80af42db3b514239022d1231c101e965dbefffeb8c6e6d05cde9",
      "treatment": "CURRENT_DEEP_SCHEMA"
    },
    {
      "artifact_record_id": "VAL001-EVIDENCE-RIGHTS-2",
      "audit_only": false,
      "binder": "validation/val001/contracts/VAL_001_ADMINISTRATIVE_CLOSURE_FREEZE.json",
      "binding_class": "ORDINARY_HASH_BOUND_RECORD",
      "claim_ceiling": "NO_PHYSICAL_VALIDATION_OR_NEW_PHYSICS",
      "current": true,
      "executable": false,
      "path": "validation/val001/VAL_001_EVIDENCE_AND_RIGHTS_INVENTORY.json",
      "puckworks_lock_applicable": true,
      "record_class": "EVIDENCE_OR_RECORD_INVENTORY",
      "record_id": "INV-7D9B433C64A33696A0CD",
      "schema_id": "evidence_or_record_inventory.v10",
      "schema_origin": "EXPLICIT_CLASS_OR_VERSION_SEMANTICS",
      "schema_path": "validation/val001/schemas/deep_record_families.schema.json",
      "schema_version": "espresso.val001.evidence_rights_inventory.v2",
      "semantic_profile": "VAL001_EXPLICIT_PROFILE_V1",
      "semantic_validator": "VALIDATE_DEEP_AND_CROSS_RECORD",
      "sha256": "deb4e4754a2cb8a268afe34bc1f6ee8c1eb1de0bd9147b8e7145b95bd992e60a",
      "static_validation": "REQUIRED",
      "structure_signature_sha256": "d97d92d65c1d83a31a31ca52210989e41bc1f384b4ea9a2399418e73bca00452",
      "treatment": "CURRENT_DEEP_SCHEMA"
    },
    {
      "artifact_record_id": "VAL-001",
      "audit_only": false,
      "binder": "validation/val001/contracts/VAL_001_ADMINISTRATIVE_CLOSURE_FREEZE.json",
      "binding_class": "ORDINARY_HASH_BOUND_RECORD",
      "claim_ceiling": "NO_PHYSICAL_VALIDATION_OR_NEW_PHYSICS",
      "current": true,
      "executable": false,
      "path": "validation/val001/VAL_001_EXTERNAL_ARTIFACT_MANIFEST.json",
      "puckworks_lock_applicable": true,
      "record_class": "EXTERNAL_ARTIFACT_MANIFEST",
      "record_id": "INV-8743DB2B54319834A267",
      "schema_id": "external_artifact_manifest.v11",
      "schema_origin": "EXPLICIT_CLASS_OR_VERSION_SEMANTICS",
      "schema_path": "validation/val001/schemas/deep_record_families.schema.json",
      "schema_version": "espresso.val001.external_artifact_manifest.v2",
      "semantic_profile": "VAL001_EXPLICIT_PROFILE_V1",
      "semantic_validator": "VALIDATE_DEEP_AND_CROSS_RECORD",
      "sha256": "52fb6eb6482bf43eda11bd9d9523d66b0f43766c37c50f3844c257df4d69059e",
      "static_validation": "REQUIRED",
      "structure_signature_sha256": "a4bc75eb6df047ca5601a05cc912d22efb5595f552e9b0eb224a32986d2c2c02",
      "treatment": "CURRENT_DEEP_SCHEMA"
    },
    {
      "artifact_record_id": "VAL001-GOVERNED-RECORD-INVENTORY-3",
      "audit_only": false,
      "binder": "validation/val001/contracts/VAL_001_ADMINISTRATIVE_CLOSURE_FREEZE.json",
      "binding_class": "BOUND_BY_ADMINISTRATIVE_FREEZE",
      "claim_ceiling": "NO_PHYSICAL_VALIDATION_OR_NEW_PHYSICS",
      "current": true,
      "executable": false,
      "path": "validation/val001/VAL_001_GOVERNED_RECORD_INVENTORY.json",
      "puckworks_lock_applicable": true,
      "record_class": "EVIDENCE_OR_RECORD_INVENTORY",
      "record_id": "INV-F65DEC165B28DF2A2D85",
      "schema_id": "espresso.val001.governed_record_inventory.v3",
      "schema_origin": "EXPLICIT_CLASS_OR_VERSION_SEMANTICS",
      "schema_path": "validation/val001/schemas/governed_record_inventory.schema.json",
      "schema_version": "espresso.val001.governed_record_inventory.v3",
      "semantic_profile": "VAL001_EXPLICIT_PROFILE_V1",
      "semantic_validator": "VALIDATE_DEEP_AND_CROSS_RECORD",
      "sha256": null,
      "static_validation": "REQUIRED",
      "structure_signature_sha256": "33605420fe1fb1cf016b9a5fae4d5a3027c87eec0a843fb2637154bf4aafe995",
      "treatment": "CURRENT_DEEP_SCHEMA"
    },
    {
      "artifact_record_id": "VAL001-GOVERNED-SCHEMA-REGISTRY-3",
      "audit_only": false,
      "binder": "validation/val001/contracts/VAL_001_ADMINISTRATIVE_CLOSURE_FREEZE.json",
      "binding_class": "BOUND_BY_ADMINISTRATIVE_FREEZE",
      "claim_ceiling": "NO_PHYSICAL_VALIDATION_OR_NEW_PHYSICS",
      "current": true,
      "executable": false,
      "path": "validation/val001/VAL_001_GOVERNED_SCHEMA_REGISTRY.json",
      "puckworks_lock_applicable": true,
      "record_class": "GOVERNANCE_RECORD",
      "record_id": "INV-D490827B023E4228EB58",
      "schema_id": "espresso.val001.governed_schema_registry.v3",
      "schema_origin": "EXPLICIT_CLASS_OR_VERSION_SEMANTICS",
      "schema_path": "validation/val001/schemas/governed_schema_registry.schema.json",
      "schema_version": "espresso.val001.governed_schema_registry.v3",
      "semantic_profile": "VAL001_EXPLICIT_PROFILE_V1",
      "semantic_validator": "VALIDATE_DEEP_AND_CROSS_RECORD",
      "sha256": null,
      "static_validation": "REQUIRED",
      "structure_signature_sha256": "dd03f0bd3227d9d9088c586fe5cd9411947d005a2a579936d47eb4c52ca4eb61",
      "treatment": "CURRENT_DEEP_SCHEMA"
    },
    {